,title,clickbait
804,Nadal Tames Wind to Win Another Title,False
805,Pope Admits Online News Can Provide Infallible Aid,False
806,"Tsunami deaths mount to more than 120,000",False
807,Thousands protest PM Harper in Toronto,False
808,"Body found in Auckland, New Zealand drain",False
809,No U.S. Plans to Stop Korea on Missile Test,False
810,"At Colonial, Greens Are Soft and Scores Are Low",False
811,Russian Wikipedia reaches a quarter million articles,False
812,New book Blown for Good reveals details inside Scientology headquarters,False
813,Department of Defense report lambasts communication failure in US War on Terror,False
814,BP: Plug for underwater oil leak in Gulf of Mexico fails,False
815,Medtronic Links 13 Deaths to Faulty Heart Device,False
816,Xavier Turns Back Upset Bid by Wisconsin,False
817,WHO director: Pandemic alert level will not be raised,False
818,Unicef: African children orphaned by AIDS could top 18 million,False
819,Australian rules football: Six goal win moves Morwell to second on Gippsland Football League ladder,False
820,Berlusconi Spars With Murdoch Over Pay TV,False
821,American Team Plans to Expand Formula One Popularity,False
822,Quarterly Profit Up 14% at Bed Bath & Beyond,False
823,Two arrests made over Croxteth shooting,False
824,Hurricane Richard makes landfall in Belize,False
825,Health Canada orders recall of contaminated toothpaste manufactured in India,False
826,"As Tamil Rebels Lose Ground in Sri Lanka, a Crisis Flares for Trapped Civilians",False
827,"Maine resident arrested in Florida for death threats to Bush, Obama",False
828,"On the campaign trail, December 2011",False
829,British boy drowns while on holiday with family in Portugal,False
830,Explosion in Baghdad claims 28 lives,False
831,Endangered Luzon Buttonquail photographed alive by Philippines documentary,False
832,African nations gather to support a ban on cluster bombs,False
833,Destroying Levees in a State Usually Clamoring for Them,False
834,Rebel leader says he will run for president in Haiti,False
835,German Adidas buys American Reebok,False
836,20-year-old captures abusive police officer on tape,False
837,One N.B.A. Star and 150 Bridges to Sichuan,False
838,Up-and-Down Knicks Get More of the Latter,False
839,Civilians dead following U.S. air strike on 'terrorist compound',False
840,Irish Enterprise Exchange Launched in Dublin,False
841,"Jack Straw, Leader of the British House of Commons urges Muslim women to drop full veil",False
842,"Two jockeys killed in fire in North Yorkshire, England",False
843,UBS Open to Settling I.R.S. Tax Case,False
844,How Long Will the Obama Honeymoon Last?,False
845,Elderly man in Scotland dies after contracting H1N1 swine flu virus,False
846,Former governor of Illinois indicted on corruption charges,False
847,Santander Offer Pressures Rivals to Match It,False
848,Chemist Shows How RNA Can Be the Starting Point for Life,False
849,ANC leads in South Africa vote,False
850,Shooting to Software Stardom on the iPhone,False
851,Ariane 5 rocket launches Superbird 7 and AMC-21 satellites,False
852,"Wikinews interviews Steve Kissing, independent candidate for US President",False
853,"At M.I.T., Large Lectures Are Going the Way of the Blackboard",False
854,Obama Urges Passage of Energy Legislation,False
855,Wikinews interviews American zoologists about pirate perches' chemical camouflage,False
856,Google sued by thousands of authors over Google Print,False
857,Obama Telephones Afghan President,False
858,The Inner Beauty of a McNugget: A Cultural Scan,False
859,Drunken man is surprised crocodile bit him,False
860,"Ships Tread Water, Waiting for Cargo",False
861,European football: Sevilla player dies after collapsing during game,False
862,Singapore Trims Its Economic Forecasts for 2009,False
863,Peanut Product Recall Grows in Salmonella Scare,False
864,Do Blobs on Phoenix Lander Indicate Water on Mars?,False
865,70 killed after tanker explosion in Nigeria,False
866,Rare Centrist in State Senate Used Power to Shape Budget,False
867,Irish Nationalist Charged in Killing of 2 Britons,False
868,U.S. Again Warns Britain on Detainee Memo,False
869,Rugby union: Noosa thrash Caloundra in Caloundra,False
870,Malware from mass SQL injections confirmed by security experts,False
871,Poverty rises as food prices increase,False
872,Words of Support for Alex Rodriguez as the Yankees Settle In,False
873,One killed in clashes over World War monument in Estonia,False
874,Tom DeLay faces two new indictments for money laundering,False
875,UK Serious Fraud Office to investigate MG Rover collapse,False
876,North Korea warns airlines over satellite fears,False
877,"In New York, Sotomayor Put Focus on the Poor",False
878,Gates Reassures Allies Over North Korea,False
879,Slow Start to U.S. Plan for Modifying Mortgages,False
880,"Wikinews interviews Kevin Baugh, president of the Republic of Molossia",False
881,"Brothels Ask to Be Taxed, but Official Sees a Catch",False
882,Atlantis lands at Kennedy Space Center,False
883,"Mongolia declares state of emergency after violent protests, five people killed",False
884,Nikolay Davydenko beats Rafael Nadal in Sony Ericsson Open,False
885,U.S. teens generally reducing risky behavior says CDC,False
886,At Least 34 Dead in Baghdad Bombing,False
887,"Twelve-year-old schoolboy stabbed, dies in Brisbane, Australia",False
888,Awkward Dance for E.U. Treaty Talks,False
889,A Midwestern Wind Infuses the U.S. With Zip and Zing,False
890,Saab in Bankruptcy Filing; G.M. Seeks More Aid,False
891,Demand Is Weak at Treasury Auction,False
892,2008 Young Designers' Exhibition to interact with the world,False
893,2010 FIBA World Championship starts,False
894,Witnesses: Doomed train had green light,False
895,Derivatives Tug of War Takes Shape,False
896,Lavalas candidate barred from elections,False
897,"As Veterans Move Up, Leaders in Full Bloom at Augusta",False
898,"Visiting students detained in Louisiana, USA, while photographing ExxonMobil chemical plant",False
899,USA under pressure at climate talks,False
900,Japanese stocks continue to fall after earthquake,False
901,Iraqi based war video game pulled by publisher,False
902,South Korean economy grew 0.2% in last quarter,False
903,NHL: Montreal Canadiens open 100th season,False
904,Utility Suspends Nuclear Plant Effort,False
905,2 Uighurs in Troubled Region Killed by the Police,False
906,Interview: University of Guam's Ron McNinch on North Korea's nuclear threats,False
907,"After Coyote Attacks, a Denver Suburb Turns to a Gun-Wielding Trapper",False
908,Man disguised as Darth Vader robs bank,False
909,Levee Break Causes Long-Lasting Trouble in Nevada,False
910,Obama Is Sworn In as the 44th President,False
911,Push in Spain to Limit Reach of the Courts,False
912,"Michael Jackson film ""This Is It"" to be premiered in at least 15 world cities simultaneously",False
913,A  New Crop of Scientists Are Using Their Children as Research Subjects,False
914,"Over 13,500 evacuated after wildfire in California",False
915,"After Pennsylvania Trial, Tensions Simmer Over Race",False
916,Former Japanese prime minister Hashimoto indicated his retirement,False
917,"Jeremy Tyler, N.B.A. Prospect, Is Groomed to Play His Own Way",False
918,First winter snowfall in New Zealand,False
919,New video released shows BBC journalist Alan Johnston wearing 'explosive belt',False
920,US unemployment rate reaches 9.4 percent,False
921,"Bombs kill US Marines, civillians in Iraq",False
922,"Impairing the European Union, Gibe by Gibe",False
923,"Laws allowing same sex marriage in Washington, D.C. go into effect",False
924,UEFA Champions League 2007/08: Rangers through after tense draw,False
925,British Airways announces record losses,False
926,Tribune Has a Favorite to Buy Cubs,False
927,Empty tower at Miami International Airport catches fire,False
928,Three shot dead at University of Alabama in Huntsville,False
929,Wikinews interviews author and filmmaker Peter John Ross,False
930,US woman sentenced to jail for faking son’s cancer,False
931,American Samoa received eight minutes warning before 2009 tsunami,False
932,"Aided by Poker Devotees, Lawmaker Pushes to End the Ban on Online Gambling",False
933,Levi Leipheimer Inches Closer to Tour of California Title,False
934,Turkish writer Orhan Pamuk receives Nobel Prize,False
935,Iraqi Soccer Team Finally Returns Home,False
936,Italian journalist Giuliana Sgrena freed,False
937,America's Cup: Alinghi wins,False
938,Reluctant Jeter Is Kept on the Bench With a Sore Ankle,False
939,Linux fifth most searched tech word on Google in 2004,False
940,"6.2 magnitude earthquake strikes Afghanistan, Pakistan",False
941,Creationist sentiments affect Imax business strategy,False
942,"Eurovision '82 winner Nicole talks about 'Ein bißchen Frieden', her success and the Contest today",False
943,"One dead after bus and bicycle crash in Hampshire, England",False
944,North Korea Moves Missile to Launch Pad,False
945,"Bad Economy Leads Patients To Put Off Surgery, or Rush It",False
946,Emir of Qatar abdicates throne,False
947,Britain's deadly bug possibly imported from U.S. or Canada,False
948,United States spies accused of illegally bugging the United Nations headquarters,False
949,S.E.C. Accuses 2 in Texas of Faking Bank Records,False
950,"After a Long Road, Missouri Coach Eyes Summit Again",False
951,Boston Wins Fourth in a Row,False
952,Australia reclaim Ashes in Perth,False
953,Marcinkiewicz's cabinet given vote of confidence,False
954,British Financial Regulator Takes Tougher Stance,False
955,Online retailers in Canada experience strong growth,False
956,Tibetan Monks Tell Tale of Escape From China,False
957,Judge Dismisses Charges Against Defendant in Grace Asbestos Trial,False
958,Australian news network under investigation over pokie reform comments,False
959,"New Jersey governor calls television show ""Jersey Shore"" negative",False
960,Pakistanis Rejoice Over Restoration of Justice,False
961,Calvin Harris knocks Michael Jackson off top spot in UK Album Chart,False
962,A Literary Legend Fights for a Ventura County Library,False
963,Assisted-suicide doctor Jack Kevorkian dies at age 83,False
964,California's same-sex marriage ban ruled unconstitutional; appeal expected,False
965,"Cambridge, Mass., city council recommends construction firm W. R. Grace remain under DEP supervision for asbestos contamination",False
966,Stone Age Flutes Found in Germany Offer Clues to Early Music,False
967,House Committee Approves Health Care Bill,False
968,Clinton Pledges More Aid to Pakistan,False
969,2 Use Guard Uniforms Made at Prison to Flee,False
970,Mark Webber wins 2009 German Formula One Grand Prix,False
971,"At least 175 killed, 200 injured in northwestern Iraq",False
972,United States Homeland Security network monitors suspicious activity,False
973,Toyota to pay US government $16.4 million over recalls,False
974,Star Wars III premieres at Cannes,False
975,Major storms batter Europe,False
976,"English policeman Nicholas Stone cleared of rape, facing jail for misconduct",False
977,Canadian scientists protest Harper's attacks on science,False
978,US army gives medical assistance to Iraq school,False
979,"McDonald's unfairly dismissed worker for giving a colleague free cheese, says Dutch court",False
980,Japanese nuclear officials race to avoid disaster as radiation levels in sea rocket,False
981,European Union gives Iran two more weeks to comply with UN resolution,False
982,"Evanston, Illinois middle school evacuated after bomb threat",False
983,Nine killed as Russian cargo plane crashes in Siberia,False
984,"Freed by the U.S., Saudi Becomes a Qaeda Chief",False
985,Maoist Rebels Kill 27 Indian Police Officers in Ambush,False
986,"As Protesters Pause in Thailand, Their Grievances Against Elite Simmer",False
987,Judd Gregg withdraws as US Commerce Secretary nominee,False
988,Gay Lights Up the Track in the 200 at the Reebok Grand Prix,False
989,U.S. team unveils plans for F1 entry in 2010,False
990,Visa seeks to issue largest IPO in US history,False
991,Web site claims Abu Ghraib attack for Al Quaida,False
992,Airline bombing suspect spent months in Yemen,False
993,U.N. Health Aid Plan Unites Air Travelers and Bill Clinton,False
994,Death of Nancy Benoit rumour posted on Wikipedia hours prior to body being found,False
995,Collegians Show a Commitment to Elevating Cricket in America,False
996,Plane from Los Angeles to London diverted,False
997,"Meth use now USA's top drug problem, survey finds",False
998,"British computer scientist's new ""nullity"" idea provokes reaction from mathematicians",False
999,File sharing site The Pirate Bay sold,False
1000,Should I Get Bings,True
1001,Which TV Female Friend Group Do You Belong In,True
1002,"The New ""Star Wars: The Force Awakens"" Trailer Is Here To Give You Chills",True
1003,"This Vine Of New York On ""Celebrity Big Brother"" Is Fucking Perfect",True
1004,A Couple Did A Stunning Photo Shoot With Their Baby After Learning She Had An Inoperable Brain Tumor,True
1005,How To Flirt With Queer Girls Without Making A Total Fool Of Yourself,True
1006,32 Cute Things To Distract From Your Awkward Thanksgiving,True
1007,If Disney Princesses Were From Florida,True
1008,What's A Quote Or Lyric That Best Describes Your Depression,True
1009,"Natalie Dormer And Sam Claflin Play A Game To See How They'd Actually Last In ""The Hunger Games""",True
1010,16 Perfect Responses To The Indian Patriarchy,True
1011,"21 Times I Died During The ""Captain America: Civil War"" Teaser",True
1012,17 Times Kourtney Kardashian Shut Down Her Own Family,True
1013,Does Coffee Make You Poop,True
1014,Who Is Your Celebrity Ex Based On Your Zodiac,True
1015,17 Hairdresser Struggles Every Black Girl Knows To Be True,True
1016,Are You More Walter White Or Heisenberg,True
1017,The Most Canadian Groom Ever Left His Wedding To Plow Out His Guests In A Snow Storm,True
1018,Here's One Really Weird Thing About Butterfree,True
1019,15 Resolutions To Make Good On In 2016,True
1020,What New Thing Should You Try In 2016,True
1021,Zoo Animals Around The World Are Opening Their Christmas Presents Early,True
1022,Tell Us About Yourself(ie): Erica Ash,True
1023,9 Times I Cried,True
1024,21 Vegetarian Dump Dinners For The Crock Pot,True
1025,This Goat Has Been Bullying His Tiger Friend,True
1026,"8 Fall Shows To Be Excited About, 10 To Give A Chance, And 6 To Avoid",True
1027,"Another Round, Episode 25: Stop Telling Women To Smile",True
1028,16 Signs You Are Too Stubborn To Live,True
1029,This Country Singer Makes Music On His Game Boy In His Spare Time,True
1030,When You Realize Every Guy Is Taken,True
1031,"An Awesome Look At The Behind-The-Scenes Concept Art Of ""Aladdin""",True
1032,"Sarah Jessica Parker Talks Being A Carrie, ""Hocus Pocus,"" And Her Love Of New York",True
1033,Which Type Of Swearer Are You,True
1034,A Dad Recorded All The Adorable Questions His Son Asked When Watching Star Wars For The First Time,True
1035,"29 Impossibly Stylish Cat Gifts, In Order Of Awesomeness",True
1036,13 Of The Most Glorious Made-Up Words From Literature,True
1037,We Pranked A Bunch Of People By Dropping An iPhone In Front Of Them,True
1038,23 Flaws Every Sneakerhead Has,True
1039,We Know Your Zodiac Sign Based On Which Cat You Choose,True
1040,"Grimes On Her New Album And The Heartbreaking Inspiration Behind ""Oblivion""",True
1041,This Instagram Account Is Recreating 2015's Greatest Hits With Barbies,True
1042,The 22 Best Adele Memes,True
1043,17 Pictures Hot People Will Never Understand,True
1044,How Badly Are You Taking The One Direction Hiatus,True
1045,We Know What You Want For Christmas Based On Your Zodiac Sign,True
1046,Guys Try Pinterest Leaf Hacks,True
1047,22 Tips For Hiking With Kids That Every Parent Should Know,True
1048,The Scariest Halloween Candy Taste Test,True
1049,This Dog Begging For His Human's Forgiveness Is The Cutest Thing You'll See Today,True
1050,Here's 100 Years Of Bollywood Cinema In Under Four Minutes,True
1051,Ed Westwick Showed Up To An Emmys Party Looking Like The Chuck Bass Of Your Dreams,True
1052,What Is Your Favorite Activity When Visiting Family,True
1053,Take This Color Test To See How Far You'd Go For Love,True
1054,Are You Brave Enough To Date A Werewolf,True
1055,18 Things Everyone Who Hates PDA Will Understand,True
1056,27 Things That Always Happen In The Office During Christmas,True
1057,How Many Of These SpongeBob Faces Do You Recognize,True
1058,Which Golden Globe Reaction Face Are You Based On Your Zodiac Sign,True
1059,25 Reasons A Trip To Costa Rica Could Actually Change Your Life,True
1060,Literally Just 46 Photos Of Scotland Looking Sexy As Hell,True
1061,58 Things That Mildly Annoy Anyone Who Lives With Someone Messy,True
1062,17 Places All Music Lovers Should Go In London,True
1063,"Do You Know The Lyrics To ""Hotline Bling"" By Drake",True
1064,Which Weasley Should Be Your Best Friend,True
1065,29 Books Every '90s Kid Will Immediately Recognize,True
1066,This Organisation Is Trying To Launch India's First Transgender Model Agency,True
1067,Request Timeout,True
1068,"Issa Rae's ""Insecure"" Is Coming To HBO At Long Last",True
1069,"How Well Do You Know ""Pretty Little Liars""",True
1070,You've Been Using Your Rice Cooker Wrong The Entire Time,True
1071,No Actors Of Color Were Nominated For An Oscar This Year And People Are Pissed,True
1072,This Guy Totally Nailed What A Modern Day Aladdin Would Look Like,True
1073,18 Easy And Delicious One-Pan Breakfasts,True
1074,We Tried Out Magic Wands And Here's What Happened,True
1075,Charli XCX Looked Like A Space Dominatrix At The MTV EMAs,True
1076,If The Avengers Looked Like They Originally Did In The Comics,True
1077,13 Reasons Urinals Are The Worst Human Invention Of All Time,True
1078,Will You Get A Free Car From Oprah Or A Free Tub Of Vaseline From Tyra,True
1079,28 Of The Most Canadian Crimes Ever Committed,True
1080,19 Beautiful Places In Scotland That Give People All The Feels,True
1081,Here's How To Actually Get Rid Of Acne All Over Your Body,True
1082,This 24-Year-Old Guy Got Drunk And Accidentally Booked An Insane Vacation,True
1083,I Asked Guys If They Were Going To Buy Leona Lewis's Exclusive Grindr Album,True
1084,24 Delicious Thanksgiving Desserts That Aren't Pie,True
1085,Country Star Jason Aldean Wore Blackface On Halloween To Dress Up As Lil Wayne,True
1086,17 Times College Literally Sucked The Life Out Of You,True
1087,"The Hardest ""America's Next Top Model"" Quiz You'll Take Today",True
1088,This Color Test Will Determine How You Like To Masturbate,True
1089,42 Of The Most Romantic Lines From YA Literature,True
1090,"This Reporter Responded To A Vulgar Comment With An Awesome ""Your Mama"" Joke",True
1091,22 People Who Were Just Smooth AF,True
1092,Are You Bart Or Lisa,True
1093,Which Zodiac Sign Are You Most Compatible With,True
1094,"How Well Do You Remember ""The Vampire Diaries"" Murder House Party",True
1095,"How Well Do You Remember ""Sabrina, The Teenage Witch""",True
1096,12 Signs You Grew Up In San Francisco,True
1097,What You Say To Someone With Chronic Pain And What They Hear,True
1098,23 Totally Amazing BodyCon Looks You'll Wanna Rock This Fall,True
1099,There's An Amazing New Beauty Box Catering To Women Of Color,True
1100,We Taught These Grandmas How To Do The Nae Nae And It Was Cute AF,True
1101,17 Perfect Products For Embracing Your Inner Kanye,True
1102,"Here's How To Draw A Hand, Maybe",True
1103,Can You Identify These Movies Based On The Main Character's BFF,True
1104,21 Tweets That Prove Your Brain Can Be A Real Dick Sometimes,True
1105,Which Badass Lady Should Be Your Valentine Based On One Question,True
1106,Anna Camp And Skylar Astin Are Engaged So Everything Is Finally Right In The World,True
1107,People Are Pretending To Faint In Front Of Their Dogs To See How They React,True
1108,Are These Smiths Lyrics Real Or Fake,True
1109,Do You Have ESP,True
1110,We Can Tell You Who You Should Date With Just Four Questions About Biryani,True
1111,21 Tweets About Having Braces That Are Way Too Real,True
1112,A Dad Surprised His Kids With His Military Homecoming By Dressing Up As A Gift From Their Elf,True
1113,Be Honest: Would You Hit That,True
1114,We Know What You Play In Your Private Sessions,True
1115,18 Posts That Prove Coconut Oil Is The Answer To All Your Problems,True
1116,19 Items Anyone Who Loves Burgers Needs To Own,True
1117,20 Confessions From People Who Are Slightly Obsessed With Outer Space,True
1118,21 Things All Vegetarian Couples Just Get,True
1119,"Will Ferrell Is The New, Badass Santa",True
1120,Mark Ruffalo Posted A Shirtless Pic Promoting Breast Cancer Awareness For Men,True
1121,Nobody Likes Hand Jobs,True
1122,Are You More Pinky Or The Brain,True
1123,"No Additional Episodes Of ""Making A Murderer"" Have Been Made Yet",True
1124,15 Times Priyanka Chopra Goddamn Owned 2015,True
1125,25 Of The Best Tumblr Memes Of 2015,True
1126,27 Pictures That Are Way Too Real If You Have A Four-Person Family,True
1127,17 People Who Slayed The Eyeshadow Game,True
1128,23 Things You Probably Shouldn't Say To Someone With Depression,True
1129,Someone Illustrated Leslie Knope's Compliments And They're Pretty Damn Cool,True
1130,People Don't Know Who David Bowie Is And We're Here To Clear That Up,True
1131,Gay Drama Teacher Responds Perfectly After A Mother Pulls Her Kids From His Class,True
1132,The 21 Best Server Memes On The Internet,True
1133,Try And Guess What Chips These Were Before We Smashed Them,True
1134,How Good At Spelling Are You Actually,True
1135,Would You Be Friends With Blair Or Serena,True
1136,For Anyone Too Tired To Go Out On The Weekend,True
1137,What People Who Go To Therapy Want You To Know,True
1138,"Here's A Photo Of Buff John Krasinski In ""13 Hours"" And It's Hard To Handle",True
1139,What Obscure Thing Should You Make Sexy For Halloween,True
1140,18 Very Sweary British Words You Need To Use Right Now,True
1141,14 Rare Photos Of Albert Einstein That You've Probably Never Seen Before,True
1142,"12 Reasons Kendrick Sampson From ""HTGAWM"" Is The Ultimate Bae",True
1143,11 Struggles Women Understand Too Well,True
1144,"Mumbai Is Sending Powerful Messages Of Love, Support, And Solidarity For Paris",True
1145,17 Thoughts We All Had While Stalking Our Exes On Facebook,True
1146,"I'm An Immigrant, But I'm Not",True
1147,This Guy's Cheese Vine Perfectly Sums Up How Silly The Daily Mail Is,True
1148,We Reenacted What Kids Said About Black Leaders And It's Amazing,True
1149,10 Movies With A Shit-Ton Of Lesbian Subtext,True
1150,17 Books That Perfectly Capture The Immigrant Experience,True
1151,Beans Memes Is The Only Twitter Account That Actually Matters,True
1152,13 Confessions About Masturbation That'll Make You Go WTF,True
1153,"The Secondary Characters Of ""Friends,"" Then Vs. Now",True
1154,Do You Belong In London Or San Francisco,True
1155,24 Potato Recipes That Should Be Illegal,True
1156,11 Charts And Graphs Every James Bond Fan Will Get,True
1157,"How Well Do You Know Season One Of ""Buffy""",True
1158,Only True New Jerseyans Will Ace This Quiz,True
1159,These DIY Oreo Churros Are Next-Level Glorious,True
1160,19 Gifts Every Classical Music Nerd Will Love,True
1161,24 Hilarious Tweets Every Book Lover Will Appreciate,True
1162,Which Christmas Movie Should You Watch Right Now,True
1163,"How Well Do You Remember Season 5 Of ""The Walking Dead""",True
1164,15 Times The Try Guys Went A Little Too Far In 2015,True
1165,25 Things You Should Never Say To Someone With Big Boobs,True
1166,"If ""Netflix And Chill"" Were Honest",True
1167,"This Wounded Veteran's Service Dog Was His Best Man, And It'll Make You Bawl",True
1168,"These Youth Football Players Quit Their Game To Do The ""Whip/Nae Nae""",True
1169,Here's How To Make The Only Birthday Cake You'll Ever Need,True
1170,These BFFs Are Slaying Internet Fashion,True
1171,"Dear World, A Word Of Advice From India: Your Butts Are Dirty",True
1172,Would You Pass Environmental Science Now,True
1173,25 Things You'll Only Get If You're Obsessed With Baths,True
1174,Amber Rose Had A Lot To Say About Kanye After Their Twitter War,True
1175,"23 Important Life Lessons ""The Hunger Games"" Have Taught Us",True
1176,15 Game-Changing Eyeliner Charts If You Suck At Makeup,True
1177,17 Beauty Hacks You Should Try In 2016,True
1178,17 Things Only Women Who Aren't That Into Makeup Will Understand,True
1179,15 Hits From 1996 That'll Make You Feel Old AF,True
1180,24 Pictures That Show 2016 Is Off To A Terrible Start,True
1181,What's The Most Beautiful College Campus In The World,True
1182,8 Urban Dictionary Definitions You Need To Know,True
1183,Here's Everything You Need To Know About Renters Insurance,True
1184,Adele Said A Mic Dropped In The Piano And That's Why Her Grammy Performance Was Off,True
1185,31 Celebrity Babies We Said Hello To In 2015,True
1186,19 Silly Assumptions About Singles In Their Thirties,True
1187,The Food At Electric Picnic This Year Looks Amazing,True
1188,"If ""Dragon Ball Z"" Characters Had Realistic Proportions",True
1189,15 Ridiculously Awkward Sex Questions Parents Have Actually Asked Their Kids,True
1190,16 Times Costco Failed So Hard It Almost Won,True
1191,Which X-Men Character Are You Based On Your Zodiac Sign,True
1192,13 Things All Slytherins Will Need In 2016,True
1193,12 People Who Are Going To Have A Really Hard Time Doing Their Job In That Costume,True
1194,We Need To Acknowledge That Niall Is The Most Underrated Member Of One Direction,True
1195,We Know How Many Times You Masturbated Last Week,True
1196,Are You More Nick Or Joe Jonas,True
