,title,clickbait
0,Bill Changing Credit Card Rules Is Sent to Obama With Gun Measure Included,False
1,"In Hollywood, the Easy-Money Generation Toughens Up",False
2,1700 runners still unaccounted for in UK's Lake District following flood,False
3,Yankees Pitchers Trade Fielding Drills for Putting Practice,False
4,Large earthquake rattles Indonesia; Seventh in two days,False
5,Coldplay's new album hits stores worldwide this week,False
6,U.N. Leader Presses Sri Lanka on Speeding Relief to War Refugees in Camps,False
7,2 Somali-Americans Charged With Aiding Terror,False
8,"US Highway Administration releases interim report on Boston's Big Dig: press release claims tunnel safe, but report does not",False
9,White House Announces International Meetings to Address Energy and Climate Issues,False
10,"With Troubled Coyotes, Gretzky Called On as Savior Again",False
11,Door opens mid-Qantas flight; plane makes an emergency landing,False
12,Gas prices surge in Northeast US,False
13,"Schapelle Corby found guilty, sentenced to 20 years",False
14,"2008 SecuTech Expo starts in Taipei, Taiwan for grasping global security industry",False
15,"New year introduces Illinois texting while driving ban, among other laws",False
16,Rod Woodson Tries to Stay Grounded Amid Hall of Fame Talk,False
17,Former US President Gerald Ford hospitalized with pneumonia,False
18,Obama Welcomes Specter to the Party,False
19,"New law to help asbestos sufferers in Victoria, Australia",False
20,France Approves Crackdown on Internet Piracy,False
21,"With Fine Print, the Rollout Dazzles This Time",False
22,UK's most-read papers found to be in contempt of court,False
23,"As Germany Sinks, Its Economic System Is Questioned",False
24,Tropical Storm Dolores now active,False
25,Car Bomb Kills Police Official in Spain,False
26,"'Invitational Games for the Deaf, Taipei 2008' starts, new slogan for 2009 Summer Deaflympics unveiled",False
27,US government stops Haiti evacuations,False
28,Credit Card Industry Aims to Profit From Sterling Payers,False
29,Google Maps incorporates satellite images,False
30,"Seven dead, one missing, two survive French helicopter crash off Gabon coast",False
31,Wikinews interviews 0 A.D. game development team,False
32,Gates Issues Warning to North Korea,False
33,Global Industrial Slump Prompts Plant Closings and Layoffs Across Asia,False
34,Nuclear leaks after Japan quake are worse than first reported,False
35,"UEFA Champions League: April 1, 2008",False
36,"Medtronic Paid $788,000 to Doctor Accused of Faking Study",False
37,Ivory Coast beats Serbia and Montenegro 3-2 in Group C,False
38,Political Shifts on Gay Rights Lag Behind Culture,False
39,Taliban militant kills at least thirteen in northwest Pakistan,False
40,National Park Service covers donation box at United Airlines Flight 93 memorial,False
41,Yankees Profit From Their Own Seventh-Inning Stretch,False
42,At least twenty dead after mudslides in Peru,False
43,Iran Plans Tests Toward Starting a Nuclear Plant,False
44,Contestant seriously injured during live German game show,False
45,Former US Senator Jesse Helms dead at 86,False
46,Kimi Räikkönen wins 2009 Belgian Grand Prix,False
47,Yahoo and Microsoft Said to Be Weighing Ad Pact,False
48,Suspect in model Jasmine Fiore's murder found dead,False
49,Irish win narrowly over Italy in RBS 6 opening match,False
50,"In Gaza, Weighing Crimes and Ethics in Urban Warfare",False
51,Australian newspapers could be fined for breaches of media standards,False
52,Bull moose shot by police in Alaska,False
53,A Town Reborn Faces a New Threat,False
54,"Islamist militia driven out of Mogadishu, vow to keep fighting",False
55,Ichiro Suzuki Delivers Memorable Conclusion to W.B.C.,False
56,Controversial U.S. abortion doctor shot dead in Kansas church,False
57,Iran executes woman despite stay of execution,False
58,General Says Shoot Dealers in Afghanistan,False
59,Former Indian President R. Venkataraman dies age 98,False
60,Failed suicide bomber imprisoned for life,False
61,Queensland win W-League Grand Final,False
62,Obama Toughens Lighting Rules to Cut Energy Use,False
63,Inuk hunter adrift on arctic ice floe,False
64,Human remains in mass grave confirm Argentina secret death camp,False
65,Australian rules football: 2010 Gippsland Football League finals take shape two weeks out,False
66,Local Agencies Team Up to Sell Industry on Minneapolis,False
67,"United Airlines to hire 2,000 flight attendants",False
68,More Banks Under Stress as Recession Wears On,False
69,"Police officer killed, at least 18 injured in south Thailand blasts",False
70,Senior Afghan General Dies in Helicopter Crash,False
71,Taibu quits Zimbabwe cricket team after further threats,False
72,"To Get a Business Loan, Know How the Bank Thinks",False
73,Muslim Brotherhood facing troubled times,False
74,Cuba to use open-source software,False
75,Dwarf gets penis glued to vacuum cleaner,False
76,"Body of missing student found in Bath, England",False
77,Botswana holds parliamentary elections,False
78,Search continues for nine missing after midair collision off California,False
79,Leaders Meet Amid Tensions Over Report Of Turkish Plot,False
80,When the Mall Looks More Like Main Street,False
81,Pork Industry Fights Concerns Over Swine Flu,False
82,Details emerge on how al-Zarqawi's location was pinned,False
83,Next generation DVD format war nearing deadline,False
84,Two Editors to Share No. 2 Spot at The Associated Press,False
85,"In Reporting a Scandal, the Media Are Accused of Just Listening",False
86,Elections in El Salvador Invoke Rivalries of Civil War Years,False
87,Olympic gold medalist Evan Lysacek gets hero's welcome in hometown,False
88,Activists protest against School of the Americas,False
89,Macedonia says compromise with Greece over name dispute possible,False
90,Alcatel Chief Tries to Paint a Rosy Picture,False
91,UN official: DR Congo is ‘rape capital of the world’,False
92,Canadian top court strikes down private medicare ban in Quebec,False
93,Shadows of Violence Cling to Indian Politician,False
94,Cafe Experience Is Shifting to the Home,False
95,Controversial Archbishop Abandons a Move to New Jersey,False
96,Pittsburgh Dominates San Diego to Reach A.F.C. Title Game,False
97,Obama Speaks at N.A.A.C.P. Celebration,False
98,Woman gives birth on New Jersey PATH train,False
99,One Bid to Organize Nurses Faces Setback in Congress,False
100,Red Sox And Varitek Agree to 1-Year Deal,False
101,"UEFA Cup: April 10, 2008",False
102,Coordinated terrorist attack hits London,False
103,"Transgender woman dies after beating in Harlem, New York",False
104,"Apple announces Mac OS X Lion, iOS 5, and iCloud",False
105,Louisville Withstands Late Villanova Threat,False
106,New Rules to Allow Some Players to Switch National Teams,False
107,Lesbians lose High Court marriage bid,False
108,Court ruling upholds expulsion of New York Senator convicted of assault,False
109,Mathematics summer school in Turkey threatened by authorities,False
110,Myanmar Presses Case Against Pro-Democracy Leader,False
111,New York Times reporter rescued in Afghanistan,False
112,"Cheney gets ovation, shooting victim apologizes to Cheney",False
113,Microsoft develops anti-virus product,False
114,Woman suffers heart attack at cardiology summit,False
115,Canadian singer Justin Bieber to publish memoir,False
116,Cable Industry Starts to Regret Putting Free Shows Online,False
117,An Unexpected Increase in Factory Orders,False
118,Moldovan president tells NATO over half a million Moldovans held hostage in separatist Transnistria,False
119,Mongolia's ex-communists ahead going into Sunday's election,False
120,Scientists debate whether Hurricane Katrina was aggravated by global warming,False
121,Britain to Add 700 Troops to Afghan War,False
122,Salmonella in Pistachios Spurs Recall,False
123,Nokia launches internet music store,False
124,UEFA Euro 2008: Błaszczykowski injury damages Poland's Euro 2008 hopes,False
125,Community forum held after attacks on Mormon teens in Arizona,False
126,Hitler doll story found to be hoaxed,False
127,Toronto Star reporter pursues legal action against Toronto Mayor,False
128,Japanese riot police deployed around consulates,False
129,Mets Show More Reasons for Their Optimism,False
130,Building in Barcelona damaged by explosion,False
131,Radiation that killed ex-spy Alexander Litvinenko found in Germany,False
132,Caterpillars force temporary closure of Wisconsin state park,False
133,Guinea arrests 100 soldiers in connection with attempted assassination of leader,False
134,IOC lifts ban on Iraqi athletes participating in the Beijing Olympics,False
135,"Deadly crash at Dayton, Ohio air show",False
136,Suspect Held in 6 Killings in South,False
137,Computer professionals celebrate 10th birthday of A.L.I.C.E.,False
138,Pakistan : New policy on renewable energy launched,False
139,Newspaper Ads Expected to Show Up to 30% Drop,False
140,UK scientists discover multiple antibiotics used by fungus-farming ants to protect colonies,False
141,Final launch of Space Shuttle Discovery delayed another day,False
142,"Two largest known prime numbers discovered just two weeks apart, one qualifies for $100k prize",False
143,"From a Beijing Suburb, Vibrant Strings",False
144,Nuclear weapons protest at Faslane leads to 47 arrests,False
145,US vice president Biden says Iran sanctions likely by early May,False
146,F.B.I. Lab Houses Growing Database of DNA Profiles,False
147,"Strong earthquake hits Pakistan, north India, Afghanistan",False
148,Elizabeth II annuls Fred Goodwin knighthood,False
149,Anti-tax tea parties held across the USA,False
150,E.P.A. Expected to Regulate Carbon Dioxide and Other Heat-Trapping Gases,False
151,National Debate About G.O.P. Hits Home in Utah,False
152,Is New KERS System a Formula One Boost or a Backfire?,False
153,Chinese Exports Fall 22.6% in April,False
154,French Officials Vow to Shut Down Migrant Camp in Calais,False
155,"DirecTV tunes out Trio, network in limbo",False
156,Somali radio stations stopped from playing music by Islamist militants,False
157,Former U.S. Presidential candidate Gene Amondson dies following a stroke,False
158,"2008 Tour de Taiwan, TaiSPO, and Taipei Cycle: 3-in-1 preview",False
159,Flooding kills 91 in El Salvador,False
160,"From Sandy Strip of Sri Lanka, Tales of Suffering as War Traps Thousands",False
161,"Forgoing Misadventures, Mets Go Quietly Instead",False
162,Iran warns against Israeli invasion,False
163,"Uninvited couple passes Secret Service checkpoint, crashes White House state dinner",False
164,"Questions raised about McCain's choice of Palin, aides insist ""thorough vetting"" process",False
165,"David Lange, former New Zealand prime minister, dies at 63",False
166,Alesis TapeLink Moves Songs From Cassette to CD,False
167,Citigroup Shakes Up Management Again,False
168,Artist Defies Web Censors in a Rebuke of China,False
169,BlackBerry Maker Forecasts Disappointing Profit,False
170,Vermont Senate Panel Approves Same-Sex Marriage Bill,False
171,US president Bush visits Canada,False
172,Bollywood stars Aishwarya Rai and Abhishek Bachchan engaged,False
173,"Pakistan government must investigate killings and abductions of journalists, says UN",False
174,German and Swedish foreign ministers agree on Gaza standpoint,False
175,"Ads, Subtle and Less So, Grace Magazine Covers",False
176,New Flexibility at Music Labels Aims to Help Web Start-Ups Thrive,False
177,U.S. Sees a Smaller G.M. in the Future Than G.M. Does,False
178,"In Control of Series, Rangers Struggle to Contain Avery",False
179,"In Parched Argentina, Worries Over Economy Grow",False
180,Nine people die after Philippine ferry sinks,False
181,Thousands attend anti-war protests in London and Glasgow,False
182,A.M.D. Reports Narrower Loss,False
183,"Chess champion is ""Fritzed"" by computer",False
184,Apple Says Jobs Has Returned to Work,False
185,Australian government to consider dropping US FTA amendment,False
186,"Scientist says he predicted Italy earthquake, was ignored",False
187,Is That Plate Speaking for the Driver or the State?,False
188,"Algerian teen falls to death in Mecca; rape, murder suspected",False
189,European Shares Mixed After a Jump in Asia,False
190,MI5 terror threat warning level raised to 'critical',False
191,"H5N1 Avian Flu virus has mutated, study says",False
192,Northern Ireland loyalist group lays down arms,False
193,Rain Makes Dustin Johnson a Winner at Pebble Beach,False
194,U.S. Women Win Race Despite Lost Shoe at Penn Relays,False
195,UK animal welfare group prosecutes woman who threw cat into bin,False
196,Melbourne Victory held to draw by Perth Glory,False
197,"Japanese survivor of both Hiroshima and Nagasaki atomic bombings dies, aged 93",False
198,Haitian Supreme Court rules Simeus eligible,False
199,Jihadis still work online,False
200,Afghan Insurgents Expand Their Use of Increasingly Sophisticated Homemade Bombs,False
201,American philanthropist Brooke Astor dies at 105,False
202,London policeman charged over G20 protest death,False
203,"Apple unveils new MacBook Air laptops, iLife '11 software suite",False
204,"Airlines, Already Suffering, Brace for Further Woes",False
205,Formula One Is Running Its Final Race at the Legendary Silverstone Track,False
206,"In Uncertain Times, the Business of Golf Is Thriving in New Orleans",False
207,Israeli PM Sharon suffers 'mild stroke',False
208,New planet found in 'Habitable Zone',False
209,Imperial Tobacco to cut over 2000 jobs,False
210,Champions League Final May Settle Ronaldo-Messi Debate,False
211,Nine killed as protests spread to Kandahar over Qur'an burning,False
212,Drunken passenger triggers UK-Dominican Republic flight's diversion to Bermuda,False
213,"Nearly 100,000 protest for closure of US military base in Japan",False
214,Fewer Letters and More Space in the Mailbox,False
215,Indonesian volcano eruption prompts thousands to evacuate,False
216,"For Snowboarders, Olympic Qualifying Is Slippery Slope",False
217,Family of killed Palestinian boy donates organs to Israeli patients,False
218,Four U.N. staff dead after plane crash in Bolivia,False
219,Barnes & Noble Beats Earnings Estimates,False
220,Israeli PM Olmert to step down in September,False
221,Deaths on South African roads at 1215 for December 2005,False
222,"Two divers' bodies found in Scapa Flow, Scotland",False
223,Clemens Still Denies Everything,False
224,US report says Afghanistan has significant mineral wealth,False
225,Hiring of Isiah Thomas Angers Some F.I.U. Faculty Members,False
226,Gardner pleads not guilty to Chelsea King murder,False
227,Tour de France: Daniele Bennati wins stage 17,False
228,"Ibrahim Ferrer, Cuban singer, dies at 78",False
229,"Post-mortem examination reveals Stephen Gately ""died of natural causes""",False
230,"Hser Nar Moo, missing Utah girl, found dead",False
231,"Scuderi, an Unlikely Savior, Emerges for the Penguins",False
232,Stabbing at Massachusetts high school leaves one dead,False
233,European Union to fund scheme to reduce aircraft emissions and noise pollution,False
234,F.B.I. and States Vastly Expand DNA Databases,False
235,Leipheimer Wins Third Consecutive Tour of California,False
236,Toronto transit union threatens strike for Monday,False
237,"Boeing Expects Layoffs to Total 10,000 in 2009",False
238,A Fitting Time to Honor Mentor of Ashe and Gibson,False
239,Empty Tents at Open Signal Decline in Corporate Spending,False
240,Serbian goal keeper debuts in Croatian football club Rijeka,False
241,Human rights group alleges U.S. prison ships,False
242,"Sri Lankan War Nears End, but Peace Remains Distant",False
243,US Secret Service officer arrested during prostitution sting,False
244,Ellen M. Iseman: Finding Our New Home in Yankee Stadium,False
245,Charlie the smoking chimpanzee dies aged 52,False
246,Second Longtime Director Resigns at Bank of America,False
247,G.M. Exits Venture With Toyota at California Plant,False
248,UK's XL Leisure Group enters administration,False
249,"Truck carrying explosives crashes, explodes in Utah",False
250,Charles Taylor to Speak at War Crimes Trial,False
251,US Chief Justice John Roberts hospitalized,False
252,"Obama, Visiting G.O.P. Lawmakers, Is Open to Some Compromise on Stimulus",False
253,New Here? Let the Phone Show You Around,False
254,Eldest son of Khadr family denied bail; purchased weapons for Afghan militants,False
255,"Zimbabwe's election delay could have 'serious implications', warns UN Secretary-General",False
256,U.S. Congressman Jason Altmire comes out against SOPA,False
257,Heavy rains start in central and southern Chile while aftershock takes place,False
258,CNN typo mixes up prospective U.S. presidential candidate with Osama bin Laden,False
259,New study shows children's perception of rainforest wildlife,False
260,"The Naming of Swine Flu, a Curious Matter",False
261,Jurors Acquit Kansas Doctor in a Late-Term Abortion Case,False
262,What Red Ink? Wall St. Paid Fat Bonuses,False
263,"UBS to Cut 7,500 More Jobs After $1.8 Billion Loss",False
264,Texas executes Mexican-born killer despite international appeals,False
265,"Defending World Skating Title, Germans Take Pairs Lead",False
266,Trapped journalists in Libya freed,False
267,European oil companies stop trade with Iran,False
268,Fiat Nearing a Deal for Chrysler Stake,False
269,St Paul's cathedral to shut down following 'Occupy' protest,False
270,CanadaVOTES: CHP candidate Stefan Jetchick in Louis-Hébert,False
271,"New York area blog spawns book deal, NBC sitcom",False
272,Report on Gene for Depression Is Now Faulted,False
273,NGOs in Taiwan to promote carbon-decreasing movements in different sectors before Earth Day,False
274,Luxembourg head of government resigns after eighteen years,False
275,Freddie Mac Executive Found Dead,False
276,Russian Ksenia Sukhinova crowned Miss World 2008,False
277,No. 8 Marquette Sends Notre Dame to Fourth Straight Loss,False
278,Earnings Decline 35% at Halliburton,False
279,The Latest Precocious Teenager Loses,False
280,Gift of footballs from United States offends Afghans inadvertently,False
281,Australia's Governor-General cuts trip short over looming election,False
282,A $1.33 Trillion Drop in New Worth in First Quarter,False
283,Afghan protestors shot after mosque raid sparks anger,False
284,Nebraska teacher sentenced to 6 years for sex with student,False
285,Texas A&M Makes Quick Work of B.Y.U.,False
286,Chile announces official list of players for South Africa Football World Cup,False
287,Al-Qaeda warns Saudi Arabia of attacks,False
288,"Car bomb kills at least three in Dagestan, Russia",False
289,Astros defeat Cardinals in second game of NLC,False
290,Fehr Says Union Called to Have 2003 Drug Tests Destroyed,False
291,Refugees From Region in Pakistan Trickling Home,False
292,Study Finds Immigration Courtrooms Backlogged,False
293,British schools to inform parents of overweight children,False
294,"China, France attempt to repair relations in wake of protests",False
295,Final match of the Chappell-Hadlee trophy washed out in Brisbane,False
296,Former Australian PM attacks parliament on apology to the Stolen Generations,False
297,"On Business, Eyes Peeled for Fliers of Another Sort",False
298,"Poll: Arabs discouraged by US policies, back nuclear-armed Iran",False
299,Three battalions of the Royal Irish Regiment to disband as part of NI peace process,False
300,A Clocker Is Waiting for a Derby Workout That Stops Time,False
301,Longtime New York radio reporter found stabbed to death,False
302,Indiana businessman held hostage in Iraq,False
303,"In Minnesota, a Battle Without End for a Senate Seat",False
304,John Edwards endorses Barack Obama,False
305,Thai Prime Minister dissolves parliament and calls elections,False
306,"Harlan Ellison sues CBS-Paramount, WGA over Star Trek royalties",False
307,European Start-Ups Take a Bet on Air Taxis,False
308,"Nokia Plans 1,700 Job Cuts as Sales Slow",False
309,U.S. government proposes removing Yellowstone grizzlies from endangered species list,False
310,Spanish police arrest 66 in child pornography raid,False
311,"Brazil's Embraer plans to cut around 4,200 jobs",False
312,Tour de France: Alexander Vinokourov fails blood test,False
313,2008 Taiwan presidential election: First official debate with citizen journalists' participation,False
314,250 Young Quakers to light up lake,False
315,"MS-13 gang threatens the Arizona ""minutemen""",False
316,Airbus A380 safety test injures 33,False
317,US Senator Robert Byrd dies at age 92,False
318,"Facebook hired PR firm to discredit Google, reveals leaked correspondence",False
319,US economist tells Portugal to seek bailout,False
320,Utah State Keeps Winning With Little Fanfare,False
321,CanadaVOTES: NDP candidate Max Lombardi running in Cambridge,False
322,Victorian Premier unveils plan for world's largest solar plant,False
323,Discovery Space Shuttle Launch scheduled for July 13,False
324,"Ukrainian president Yushchenko dismisses PM, cabinet",False
325,Officials Set Timetable for Getting Particle Collider Back on Track,False
326,"Fire breaks out in Ku-ring-gai Chase National Park, Australia",False
327,Layers of Armed Forces Wielding Power of Law,False
328,FBI raids creator of fake boarding pass generator,False
329,Australia in a good position after first day of Adelaide test match,False
330,"Australian offshore drilling rig leaks oil, could take weeks to plug",False
331,Russian Businessman Viktor Bout Accuses D.E.A. Agents in Extradition Fight,False
332,Australia flash flooding traps thousands,False
333,"One dead after motorcycle and car collision in Guernsey, Channel Islands",False
334,Merv Griffin dies at 82,False
335,A Settlement Appears Likely in UBS Tax Case,False
336,Standoff at Islamabad mosque claims at least 9 lives in Pakistan,False
337,Madeira storm kills at least 42,False
338,"Bus crashes into shop in Cardiff, Wales",False
339,New South African Leader Emphasizes Continuity in Cabinet Lineup,False
340,2010 Komen St. Louis Race for the Cure becomes world's largest Komen race,False
341,Pakistani Charged in Mumbai Assault,False
342,United States charges eleven in credit card fraud case,False
343,Malawi President pardons jailed gay couple,False
344,US Army to court martial soldier over three Afghan murders,False
345,English actor Norman Painting dies at age 85,False
346,Randy Johnson Has Lost a Little Off His Fastball but Not His Reputation,False
347,Texas authorities obtain DNA from jailed FLDS leader Warren Jeffs,False
348,Thirteen arrested in connection with Baghdad bombings,False
349,US undergraduate commits suicide after 'outing' via webcast,False
350,Five Detained After Cairo Bomb Blast,False
351,German Social and Christian Democrats agree on new government,False
352,Duke upset by FSU,False
353,Some Fans Feel Citi Field Ignores the Old Mets,False
354,A Strong Week   Ends on Down Note,False
355,Liz Claiborne Looks for a Mizrahian Lift,False
356,Indian Army celebrates Victory Day on 35th Anniversary of Bangladeshi Liberation,False
357,European parliament says NO to software patents,False
358,Former White House press secretary Robert Gibbs may work for Facebook,False
359,Taliban Truce Seems in Flux in Pakistan,False
360,"Hunted by Puma, It Flees, but Against Fox, It Fights",False
361,United States re-elects Barack Obama,False
362,Skype apologises after service goes down for hours,False
363,"Utilities Turn Their Customers Green, With Envy",False
364,Court Appears Poised to Rewrite Campaign Spending Rules,False
365,Sources: State Department official source of Plame leak,False
366,Obama Defends Agenda as More Than Recession,False
367,Sprinter Allan Davis wins the Tour Down Under,False
368,Several police officers killed in suicide bombing in Afghanistan,False
369,Australian Treasurer told to 'try harder on welfare',False
370,The Universal Remote Dormant in Your Smartphone,False
371,Young Norwegian Boasson Hagen Rides Like  Veteran in First Giro,False
372,North Korea shuts down nuclear reactor,False
373,Zimbabwean opposition leader rejects calls for power sharing talks,False
374,"Connecticut Beats Marquette, Giving Calhoun 800th Victory",False
375,World Bank Sees Slump in Russia Worsening,False
376,Turkey sends thousands of troops into northern Iraq,False
377,Tarantino wades through Manila floods,False
378,FBI investigates AT&T security breach,False
379,Maker of BlackBerry Posts 33% Profit Increase,False
380,Leaders Say Obama Has Tapped Pastor for Outreach Office,False
381,G.M. Lowers 2009 Outlook for All U.S. Auto Sales,False
382,"Behind Red Tides, the Swimming and Shape of Plankton",False
383,"Waiting for Madoff, Angry Crowd Is Disappointed",False
384,Number of breaches during New Zealand's end of year exams,False
385,"After Drubbing, U.S. Will Face  Dutch in World Baseball Classic",False
386,"Despite Profit Decline, Optimistic Words at Nokia",False
387,Double car bombing attack in Mosul kills 26,False
388,NASCAR: Kurt Busch wins 2011 Budweiser Shootout,False
389,Didier Drogba withdraws from Cote D’Ivoire national football team,False
390,"Karl Rove, senior political advisor to President Bush will resign",False
391,Chinese Hostages Freed in Iraq,False
392,"Document reveals U.S., Taliban discussed bin Laden assassination",False
393,19 South Koreans return home after release from Taliban captivity,False
394,Policeman killed in football-related violence in Italy,False
395,Job Losses Push Safer Mortgages to Foreclosure,False
396,Gannett Plans to Furlough Employees for a Week,False
397,New Search Technologies Mine the Web More Deeply,False
398,"Gunman Was Suspect in Rape, Police Say",False
