,title,clickbait
399,Russian pilot crashes in Lithuania,False
400,Croatian singer beaten in Belgrade,False
401,Former Costa Rican president sentenced to jail on charges of corruption,False
402,Balancing Needles and Cigars,False
403,League table of world universities published: top three from USA,False
404,Iraq Warily Moving Ahead on Oil Contracts,False
405,New Hands-Free Headsets From Plantronics and Aliph,False
406,"Ailing, Mickelson Outplays Watney in Final Round at Doral",False
407,Prisoners escape from Afghan jail after Taliban attack,False
408,Omnifone Nears Broadband Music Service in Europe,False
409,Second stone circle found one mile from Stonehenge,False
410,Officers accused of framing men for murder in UK's 'biggest' trial of police,False
411,Kyrgyzstan votes on referendum for new constitution,False
412,Bravitude climbing fast on Google,False
413,World War II veteran regains use of second eye after freak accident,False
414,Former U.S. governor Palin signs TV deal with Fox News,False
415,"Villanova Upsets Pittsburgh, and Providence Beats Syracuse",False
416,Peter Capaldi named twelfth Doctor Who,False
417,163 dead after lead poisoning in Nigeria,False
418,Fossett set to recreate first non-stop trans-Atlantic flight,False
419,Intel's offices across the EU raided,False
420,"Wikinews interviews Kent Mesplay, Green Party presidential candidate",False
421,BBC broadcasts first live episode of EastEnders,False
422,US satellite radio provider Sirius unveils portable player,False
423,"2008 YODEX: The first-ever ""Wow! Taiwan Design Competition"" announced",False
424,Wikinews interviews Prince Christopher I of the Principality of Vikesland on his micronation's recent space launch,False
425,Bob Barker to retire as host of U.S. gameshow The Price Is Right,False
426,Report: quarterback Michael Vick won't plead guilty to killing dogs,False
427,"New regional jet takes off from St. Petersburg, Russia",False
428,Australian government commits AU$60 million to cut greenhouse emissions,False
429,14 killed in Russian bus-truck collision,False
430,U.S. Rep. Conyers raises Bush censure issue,False
431,Astronauts Let Go of Refurbished Hubble,False
432,"Crane levels New York City townhouse, leaving 4 dead",False
433,First television channel in Esperanto launches online,False
434,"Second Bangkok airport closed, protests continue",False
435,Drop in Net Income and a Warning From U.P.S.,False
436,Billionaire philanthropist Leonore Annenberg dies at 91,False
437,Author Amy Scobee recounts abuse as Scientology executive,False
438,Halliburton's KBR awarded half billion dollar repair contract for Gulf Coast Navy facilities,False
439,"Citing Cost, States Consider Halting Death Penalty",False
440,U.S. Republican Party television ad bashes Canada,False
441,Quebec's Liberal premier Jean Charest wins third term,False
442,Qantas Airways Sharply Cuts Annual Profit Forecast,False
443,Canadian theatre producers sentenced for fraud,False
444,Election complaint against Fred Thompson,False
445,24 Gang Leaders and an Intervention Specialist Are Indicted,False
446,A Combative Trial in Colorado as a Controversial Ex-Professor Seeks to Win Back His Job,False
447,A Disruptive Venture Capitalist Shakes Up a New Field,False
448,Should Design Be Held Back by a Tyranny of Data?,False
449,Three killed in Tennessee vehicle crash,False
450,CIA contractor released from Pakistan,False
451,Chinese Mine Disaster Ends With 74 Dead,False
452,"Skip the Newspaper, Save the Planet?",False
453,Windows 7 gets 'early release' in China; software pirates beat Microsoft to the punch,False
454,South Koreans Express Fatigue With a Recalcitrant North,False
455,"Egyptian Political Dissident, Imprisoned for Years, Is Suddenly Released",False
456,Reporter Jailed in Iran Passes Week on Fast,False
457,Moldovan premier invites Romanian counterpart to pipeline start,False
458,Fossilized remains of small dinosaur rediscovered in Canada,False
459,Canada's Conservatives launch new ad campaign,False
460,Four Pakistani policemen shot dead,False
461,Demonstration in Hong Kong denounces WTO,False
462,"With arrival of rainy season, perennial scramble in Zimbabwe for seed, fertilizer",False
463,Alleged Bush-Blair Al-Jazeera bombing transcript leaked,False
464,Australians Rage Against Arson Suspect,False
465,Ethiopians vote amid opposition charges of fraud,False
466,Uganda introduces anti-homosexual legislation,False
467,"Man killed in harbour car crash in Cornwall, England",False
468,Hepatitis scare at New Zealand McDonald's restaurant,False
469,"'Enough, enough, enough, enough': 1700 women march against mass rape in DR Congo",False
470,Jenson Button wins Hungarian Grand Prix,False
471,"Tamil Nadu Elections: DMK, AIADMK promise freebies",False
472,U.S. EPA submits 2003 greenhouse gas inventory to U.N.,False
473,Amazon Rights Error After Tweet-Rage on Twitter,False
474,Rising Calls to Regulate California Groundwater,False
475,"Massachusetts man charged with conspiring to attack US mall, kill Iraq troops",False
476,Freddie Starr arrested as part of Savile child sex inquiry,False
477,Scottish singer Jai McDowall wins fifth Britain's Got Talent series,False
478,South Africa Bars Dalai Lama From a Peace Conference,False
479,Uzbeks fleeing across border to seek refuge,False
480,Australian Prime Minister announces new cabinet,False
481,Moderate Is Said to Be Pick for Court,False
482,13 Big Equity Firms Pledge to Invest Responsibly,False
483,Microsoft launches its anti-piracy campaign in the United States,False
484,Red Cross reveals it told U.S. officials about Koran disrespect on multiple occasions,False
485,Getting a Glimpse of the Lighter Side of A.J. Burnett,False
486,Austrian students protest new government's student fees plan,False
487,ALA observes banned book week,False
488,"As Troops Enter Gaza City, Israel Sees an Opening",False
489,Fire and explosions kill at least 30 at Iranian chemical factory,False
490,"Biological Encyclopedia website too popular on first day, crashes",False
491,"Peter Chernin, Its President, Leaving News Corp.",False
492,Soccer in the U.S. Is Still Waiting for Its Moment,False
493,"As Oil and Gas Prices Plunge, Drilling Frenzy Ends",False
494,Increased tension in border dispute between Eritrea and Ethiopia,False
495,Fiji girls missing; feared dead,False
496,30 people die in bombing in northwestern Pakistan,False
497,A Calmer Iraq Takes Another Try at the Ballot,False
498,"As Mexico Border Tightens, Smugglers Take to Sea",False
499,Kenyan court jails seven pirates for 2009 attempted hijack of Maltese ship,False
500,Pakistani journalist found dead in home,False
501,Bomb blast damages buildings in Athens,False
502,Seventy arrested after fight in Moscow,False
503,Winning British EuroMillions lottery ticket worth £56 million claimed,False
504,Four miners trapped in Ecuador mine,False
505,Lower Oil Prices Hurt ConocoPhillips Earnings,False
506,Slovenian cyclist Jure Robič dies in traffic accident aged 45,False
507,Visa Posts Better-Than-Expected Profit Results,False
508,Pakistani Military Launches Airstrikes on Taliban Strongholds,False
509,Obama Confronts a Choice on Copters,False
510,Gastric bypass surgery performed by remote control,False
511,Ed to wed: UK Labour leader Miliband announces engagement to Justine Thornton,False
512,Kimi Räikkönen wins 2007 French Grand Prix,False
513,"Vietnam fishing vessel sinks in South China Sea, 27 missing",False
514,Bringing Up a 'Baby' Rolls-Royce,False
515,Rokot launches three Gonets satellites,False
516,"Cargo plane crashes in Dubai, two dead",False
517,"Poker's all about luck, says Swiss Supreme Court",False
518,N. Korea Issues Threat on Uranium,False
519,Atomic Agency Examines Candidates to Replace ElBaradei,False
520,Security firm identifies United States as world's top spamming country,False
521,Deceased Indonesian man had suspected case of bird flu,False
522,Jeff Gordon wins the 2011 Subway Fresh Fit 500,False
523,Afghan Women Protest New Law on Home Life,False
524,Huge star cluster discovered in neighbourhood of Milky Way,False
525,2008 Taipei Game Show review: Variations differ from past years,False
526,Six dead after shooting spree in Belgorod,False
527,Earthquake shakes Athens,False
528,Media reports exaggerate cell phone cancer risk,False
529,Civil War Site Coming Back After Storms,False
530,Brazil Expands Investment in Offshore Drilling Projects,False
531,Twin car bomb kills 20 in Iraq,False
532,"Netanyahu Backs Palestinian State, With Caveats",False
533,U.S. and China in trade dispute,False
534,Years of International Herald Tribune Articles Disappear,False
535,Israeli shelling on UN school on the Gaza Strip kills six,False
536,China to launch second space mission in October,False
537,Russian Uranium Sale to U.S. Is Planned,False
538,Bomb Blast Kills Tourist in Cairo,False
539,US air carrier Spirit Airlines announces $45 carry-on baggage fee,False
540,Long-Lost Lincoln Letter Is Returned to Archives,False
541,UN 'optimistic' on tsunami aid effort,False
542,Tech Mahindra Wins Bid to Control Satyam,False
543,US trade deficit soars to new high of US$61.04 billion,False
544,"Katharine Close, 13, wins Scripps National Spelling Bee",False
545,Israelis Cede More Control of West Bank Security,False
546,Public Pension Managers Rethink Hedge Fund Ties,False
547,Anglo American Rejects Merger Bid by Mining Rival,False
548,"Before Kentucky Derby History Along the Rail, a Partnership Began in a Bar",False
549,CanadaVOTES: CHP candidate Pastor George D. Campbell running in Dartmouth—Cole Harbour,False
550,New Jersey jury clears man of five murders over 1978 teens' disappearance,False
551,British oceanliner QE2 makes final journey home,False
552,US congresswoman Gabrielle Giffords shot at Arizona supermarket,False
553,"If Automakers Shed Pensions, Others May Follow",False
554,"After Megamerger with Wyeth, Pfizer Gets to Work",False
555,Gates pledges $600 million for Global Plan to Stop Tuberculosis,False
556,Recession Drains Social Security and Medicare,False
557,Former WWE superstar Jeff Hardy arrested on major drug charges,False
558,Pirates capture Saudi oil tanker,False
559,Ex-Lehman Trader Guilty of Fraud Charges,False
560,Record Deliveries Help Airbus Parent Post Profit,False
561,Recall in Kansas City Fails,False
562,Drug Tie Seen to Protests in Mexico,False
563,Mesmerizing Barcelona Beat Manchester United With Style in Champions League Final,False
564,Suicide Bomber Kills 30 in Baghdad Pilgrimage Attack,False
565,Pakistan's intelligence agency said to support Taliban,False
566,Discovery docks with International Space Station,False
567,Filesharing software distributor LimeWire ordered to close by court,False
568,Avalanche in Canadian Rocky Mountains kills two,False
569,Paramilitary group calls for end to rioting in Northern Ireland,False
570,North Korea Is Said to Test-Fire 3 More Missiles,False
571,45 killed after Yemen protesters fired upon,False
572,New Zealand Music Month kicks off for 2008,False
573,England's Football Association complains over missed goal,False
574,Astronomers discover large exo-solar system,False
575,Edmonton prison conflict wounds eight,False
576,"Synthes, Medical Device Maker, Accused of Improper Marketing",False
577,No-confidence vote initiated against Romanian cabinet,False
578,Wimbledon Officials receive criticism from animal rights group after shooting birds,False
579,Bombing in Iraq kills US Marines and civilians,False
580,"Flash floods kill over a hundred in India, 500 missing",False
581,Suicide bombers kills 31 in Pakistan,False
582,Venture Capital Investment Sinks to Lows Not Seen Since 1997,False
583,Australia's million-dollar-a-month Nauru detention centre for two refugees,False
584,"Outlook for Luxury Goods Grim, One Maker Says",False
585,Tropical Storm Irene passes over New York,False
586,Plane crash in Congo kills at least 70,False
587,American Alpine ski racer James Heuga dies at age 66,False
588,Violence in Iran increases,False
589,Maryland Strikes a Blow for the A.C.C.,False
590,England and Wales Director of Public Prosecutions to seek bomb plot retrial,False
591,Controversial Brazilian dam gets preliminary approval,False
592,Leipheimer Can Only Watch as Astana Teammates Move On,False
593,"Knicks Need a Point Guard, but Picking Eighth, Who Knows?",False
594,Amy Winehouse wax model unveiled,False
595,"As Workers Die at Work in Italy, a Call for Change",False
596,High-Flying Dwight Howard Rattles the Cavaliers,False
597,N. Carolina Routs Virginia; Next: Top-Ranked Connecticut,False
598,Knicks May Lose Gallinari for Season,False
599,Data Shows Deepening of Slump in Europe,False
600,U.S. Soldier Kills 5 of His Comrades in Iraq,False
601,Two more found guilty in 1993 Mumbai blasts case,False
602,TV Land Tries to Spice Things Up With Reality Show,False
603,Zimbabwe prepares for election,False
604,KJ Noons stripped of EliteXC Lightweight Title,False
605,Posted deadlines for Christmas delivery,False
606,New report details strain on US Army,False
607,China's economy surpasses Japan's in second quarter,False
608,"FBI recruits for ""War on Porn""",False
609,Somali pirates agree to release Egyptian ship with fertiliser cargo and 28 crew,False
610,"Lordi horror movie receives 300,000 euros of Finnish government funding",False
611,Generic Tamiflu in India,False
612,"Report: 50,000 American casualties in Iraq",False
613,Colorado counties consider forming new U.S. state,False
614,Lebanese-Syrian meetings reach full withdrawal accord,False
615,Saudi Arabia resumes livestock trade with Somalia,False
616,"UEFA Champions League: April 2, 2008",False
617,Cuomo Wins Ruling to Name Merrill Bonus Recipients,False
618,IPCC claims about Himalayan glaciers were not based on science,False
619,Wagoner Retains His Optimism as He Bows Out,False
620,Albany Bars Placement Agents for Pension Fund,False
621,World's first double arm transplant undertaken in Munich,False
622,Pennsylvania cop on trial for allegedly murdering girlfriend's estranged husband,False
623,"Wikinews interviews Juana Bustamante, Chilean earthquake survivor from Paniahue",False
624,Tensions rise between North Korea and United States,False
625,Ants Adjust Foraging So the Colony Eats Right,False
626,Mountaineers 'Climb Up' for AIDS funding,False
627,New insulin-resistance discovery may help diabetes sufferers,False
628,Louisiana officials accused of blocking rescue volunteers,False
629,"Wales win Grand Slam, RBS Six Nations and the Triple Crown",False
630,"Banks Have Raised Billions Since Test, Geithner Says",False
631,Allotting of Iraqi Oil Rights May Stoke Hostility,False
632,Keeping Pitchers Under Thumb at World Baseball Classic,False
633,ITMS Canada launched,False
634,Adding Up the Toll of a Longer Season,False
635,"Bristol Harbour Festival 2008 lauched, 200 thousand expected to attend",False
636,"NASCAR: Edwards wins O'Reilly Auto Parts Challenge, Brad Keselowski clinches Nationwide Series",False
637,Doping Rules Vague About New Medical Procedure,False
638,Two-minute silence for London bombings marked across the EU,False
639,"Kosovo Ex-Premier, Agim Ceku, Is Arrested in War Crimes Case",False
640,Pressure mounts against Florida church plans to burn Qur'an,False
641,Oil prices fall as reserves are released,False
642,Coca-Cola Considers Buying Back Shares,False
643,Obama expands Bush's faith-based initiatives,False
644,Bank of America Sells Stake in Chinese Bank,False
645,S. Korean President Reshuffles Cabinet,False
646,"Run the Refinancing Numbers, Then Run Them Again",False
647,Lucas Glover Wins U.S. Open With Unlikely Poise,False
648,Where Old Airplanes Go to Die,False
649,Former Taiwanese president jailed for life on corruption charges,False
650,Australia Ends Ban on Shorting Financial Stocks,False
651,Aging of Water Mains Is Becoming Hard to Ignore,False
652,"For Coaches, Recruiting Top Players Can Have a Dark Side",False
653,"Washington, D.C. sniper John Allen Muhammad executed by lethal injection",False
654,Italy urges pilgrims to avoid Rome city centre for Pope funeral,False
655,"1,100 evacuated due to massive Halifax brush fire",False
656,Fires at Baxter Immigration Detention Centre in South Australia,False
657,US President Bush meets with Canadian and Mexican leaders,False
658,Use of Web Tracking Tool Raises Privacy Issue in Britain,False
659,Canadian light aircraft stolen; Wisconsin State Capitol evacuated,False
660,Jet Goes Down in Indian Ocean With 153 Aboard,False
661,Seven Moroccans killed in bus crash in central France,False
662,45 Centrist Democrats Protest Secrecy of Health Care Talks,False
663,Deer and other animals found dead at Ball State University,False
664,West Virginia Upsets No. 12 Georgetown,False
665,World’s largest ice 'Father Christmas' built in China,False
666,Australia announces plans to close five mainland refugee detention centres,False
667,BBC reporters arrested in Iran on suspicion of espionage,False
668,Capitals Return to Peak Form,False
669,"As Detroit Struggles, Foundations Shift Mission",False
670,Study Looks at Mortality in Post-Soviet Era,False
671,Gallup poll: Islamophobia prevalent in United States,False
672,Takeover of Belgian Bank Ignites Anger at Meeting,False
673,Canada and Newsweek Seek Release of Reporter Detained in Iran,False
674,Officer dies after accident in President Bush's motorcade,False
675,Plan to Kill Lions to Protect Deer,False
676,Rachel Alexandra to Face Colts In Haskell,False
677,German Football: Lahm signs contract with Bayern Munich until 2012,False
678,Australian state of Queensland will go to the polls on March 21,False
679,Churches and Envoy Attacked in Iraq,False
680,"Ninth World Games open in Santiago de Cali, Colombia",False
681,Canadian military accused of Agent Orange cover up,False
682,San Francisco's Green Party endorses Cindy Sheehan in bid against Speaker Pelosi,False
683,Obama Tries Out His Dexterity in the World Cup,False
684,Senate Scraps Automatic Raise,False
685,"Fremantle defeat Sydney, qualify for 2013 Australian Football League Grand Final",False
686,Public health officials advise on rising flu levels in Texas 2013/2014 season,False
687,"For Some in Crowd, a Day of Cold and Confusion",False
688,Police: Austrian children kept in dungeon were in 'oppressive' conditions,False
689,NASCAR: Tony Stewart wins 2010 Pepsi Max 400,False
690,"In Moscow, an Attempt to Wed Pushes Gay Rights",False
691,HIV-positive man receives 35 years for spitting on Dallas police officer,False
692,Large Hadron Collider reaches milestone,False
693,World-record wind speed confirmed,False
694,American-born terrorist gets 24 years,False
695,Investigation launched after two military aircraft nearly collide with passenger airliner,False
696,Republicans Press Judge About Bias,False
697,Vanessa Hudgens publicist makes apology about nude photo incident,False
698,U.S. Begins Third Effort to Convict 6 in Terror Case,False
699,Vodafone buys Connex and Oskar,False
700,Cellphone Abilities That Go Untapped,False
701,Religious broadcaster Pat Robertson warns Pennsylvania town of disaster,False
702,Regulators Zero in on Risks of Airbus Sensors,False
703,International controversy over UN declaration to stop anti-homosexuality legislation,False
704,"Wikipedia and sister projects prepare new, easier interface",False
705,British Newspaper Says It Caught Lords Offering to Lobby for a Fee,False
706,Crude oil prices reach one-year high,False
707,African refugees allege forced labour by Turkish police,False
708,U.S. House vote forced on immediate pullout of troops in Iraq,False
709,Connecticut becomes third U.S. state to allow same-sex civil unions,False
710,Scientists confirm new superheavy element,False
711,Bush addresses nation on economic crisis; Congress debates bailout,False
712,"Fear and loathing on the campaign trail, October 2008",False
713,"Jenson Button wins 2009 Australian Grand Prix, Brawn teammate comes second",False
714,Fourteen dead in two attacks in Somalia,False
715,Relations Warms Between Russian Orthodox Church and Vatican,False
716,Saddam Hussein admits to requesting trials,False
717,Tornadoes rampage through Mississippi,False
718,Business Graduates Looking Beyond Wall Street,False
719,New drawing by Leonardo Da Vinci found,False
720,Publishers seek injunction against Google Print,False
721,Turbulence on Northwest Airlines flight injures 47,False
722,Bomb threat delayed an Air France flight to Paris days before Flight 447 crashed,False
723,"Man calls for seizure of Justice Souter home, under eminent domain ruling",False
724,Obama renominates Bernanke as US central banker,False
725,A Promise to Be Ethical in an Era of Immorality,False
726,"Europe hit by storms, 45 deaths reported",False
727,FDA report criticizes conditions in factory that produced recalled medications,False
728,BSkyB director joins Setanta,False
729,"Massa wins 2006 Brazilian Grand Prix, Alonso and Renault win championships",False
730,British music royalties suffer first ever decrease,False
731,"Wounded, and Stories of Loss, Fill a Hospital",False
732,Deadly quake hits southwestern Pakistan,False
733,Australian Senate Committee recommends formation of Charities Commission,False
734,Subject of high-profile Italian euthanasia case dies,False
735,US healthcare bill passes Senate vote,False
736,Medvedev Visits Newspaper of Slain Journalists,False
737,New Zealand Takes a Pause in Cutting Rates,False
738,IMF approves US$1.13 billion loan to Pakistan,False
739,Obama Urged to Move Swiftly to Rescue Banks,False
740,Michael Jackson doctor charged with involuntary manslaughter,False
741,"Ryanair threaten legal action after documentary on fuel policy, safety",False
742,Chinese Question Police Absence in Ethnic Riots,False
743,Joseph Kabila declared winner of Congo Presidential election,False
744,Death toll up to six in Minneapolis bridge collapse,False
745,"2007 World Deaf Swimming Championships Day 3: ""Bad weather"" and ""New Record Day of Belarus""",False
746,Seattle homeless advocates arrested for blocking intersection,False
747,Two-year-old punished in dryer,False
748,First casualty of French riots reported,False
749,France Announces $8.5 Billion Plan to Help Struggling Auto Industry,False
750,11 MPs ejected from Australian parliament,False
751,Minorities Report Discrimination in E.U. Survey,False
752,Hundreds of Thousands Protest in France,False
753,Scientists say that a 'global layer of water' exists on Saturn's moon Titan,False
754,Tibet Atrocities Dot Official China History,False
755,Emerging Markets Regain Their Footing,False
756,Amber alert issued for missing Utah girl,False
757,Pettitte Meets Prosecutors in Clemens Inquiry,False
758,Apple cancels NBC Fall TV lineup on iTunes,False
759,Iraq's UN Envoy accuses U.S. Marines of 'cold blooded murder',False
760,New Zealand journalist deported from Fiji,False
761,"Officials: Seventeen insurgents killed in Orakzai, Pakistan",False
762,"Wikinews interviews Brenton Clutterbuck, candidate for the electorate of Maroochydore at the upcoming Queensland election",False
763,"Locks Still Flowing 20 Years Later, Ron Duguay Returns to the Ice",False
764,Hewlett-Packard to expand partnership with SAP,False
765,"Steelers Arrive, Talking About Short Messages and a Tall Receiver",False
766,"Davao City, Philippines militant leaders declare victory",False
767,Lebanese Soldiers Killed in Ambush,False
768,NASA calls end to Mars Phoenix mission,False
769,US presidential candidate Barack Obama's lead increases after Democratic National Convention,False
770,Industry Fears Americans May Quit New Car Habit,False
771,Argentina Decides to Move Up Its Elections,False
772,A Shelter That Could Start a Stampede,False
773,Microsoft Windows metafiles are a vector for computer viruses,False
774,Iran unveils part of its nuclear program,False
775,Chinese rioters storm Japanese embassy in Beijing,False
776,Israel seizes ship claimed to be carrying weapons for Gaza,False
777,Victoria power grid collapses due to spot fires,False
778,Thai political talk show taken off during media buyout attempt,False
779,NHL: Ducks charge to two game lead over Wild,False
780,Christian youth camp directors charged with dragging 15-year-old girl behind van,False
781,First encyclopedic dictionary of the Black Sea released,False
782,A Choice for Drug Czar,False
783,French fashion designer Yves Saint Laurent dead at 71,False
784,Steel Industry: Tata buys Corus,False
785,One killed in University of Oklahoma explosion,False
786,Cuba sentences USAID worker to fifteen-year prison term,False
787,Sunderland A.F.C. announce Steve Bruce as their new manager,False
788,National Rugby League Women in League Round celebrates sons,False
789,"McCain delays campaign, Obama says continue the debates",False
790,RU486 debate complicates with amendments posed in Australian House of Representatives,False
791,Bomb explosions kill several people in central Baghdad,False
792,Partizan Belgrade kicked out of 2007/08 UEFA Cup,False
793,Rules may be bent to launch Discovery,False
794,Lamoureux Twins Give Minnesota a 1-2 Punch,False
795,Nine killed after bombings in southern Afghanistan,False
796,Cargo ship Arctic Sea may be found,False
797,MST attack in Rondonia kills one man,False
798,2008 Taiwan Designers' Week shows potential of innovations,False
799,Australian PM says proposed Anti-Terror Laws are Constitutional,False
800,Bank of Japan Upgrades Its Outlook for Economy,False
801,Sri Lankan president declares victory over rebels,False
802,Coming Soon to Your Language: More of the Web,False
803,Spain's Ibiza airport evacuated after bomb alert,False
